{
  "schemaVersion": "1.0.0",
  "authorityId": "7a7a7a7a-7a7a-4a7a-8a7a-7a7a7a7a7a7a",
  "publicationId": "33333333-3333-4333-8333-333333333333",
  "assessmentId": "11111111-1111-4111-8111-111111111111",
  "sourceSetDigest": "e17b7785386dc24c25bd65dbfa8e3bbf10db321beae85443f7eeb9b7f7bc94c4",
  "mutationLeaseId": "7b7b7b7b-7b7b-4b7b-8b7b-7b7b7b7b7b7b",
  "mutationLeaseDigest": "cb38ffc043b08c40c35fbfeea5d30e8c8c5495b2fad91a06db7f1d337dbdf261",
  "mutationFencingToken": 4,
  "outputCursorId": "67676767-6767-4767-8767-676767676767",
  "outputCursorRevision": 4,
  "outputCursorDigest": "7f1e7af6e2d2046ed9a42af81895aa316666cb362a1599d1b2ba47dd496b9bd5",
  "outputCursorSnapshotToken": "038f2fb52e8815faaf0a0117d1eaa89adaa96d771960b5d61ca23254444ef59a",
  "outputCursorReadAt": "2026-07-21T00:10:00.825Z",
  "commentInventoryObservationId": "79797979-7979-4979-8979-797979797979",
  "commentInventoryDigest": "b80a4d76019288a77527be048269d04e0e6cd8da249833372d9f89e15479cfab",
  "authorizedCommentIds": [
    123456
  ],
  "observedAt": "2026-07-21T00:10:00.900Z",
  "authorityDigest": "160619c4181c7038f942229d29ccae3e5442d691eafcdee60be085fb5532e6bb"
}
